<?xml version="1.0" encoding="ISO-8859-1"?>
 
<!DOCTYPE service-xml PUBLIC "-//Sun Microsystems, Inc.//DTD JAIN SLEE Service 1.0//EN" "http://java.sun.com/dtd/slee-service_1_0.dtd">
 
<service-xml>
    <service>
        <service-name>TestPTI01Service</service-name>
        <service-vendor>ptinovacao.pt</service-vendor>
        <service-version>1.0</service-version>
        <root-sbb>
            <sbb-name>TestPTI01Sbb</sbb-name>
            <sbb-vendor>ptinovacao.pt</sbb-vendor>
            <sbb-version>1.0</sbb-version>
        </root-sbb>
        <default-priority>0</default-priority>
    </service>
</service-xml>
