<?xml version="1.0" encoding="utf-8"?>
<!DOCTYPE service-xml PUBLIC "-//Sun Microsystems, Inc.//DTD JAIN SLEE Service 1.0//EN"
                             "http://java.sun.com/dtd/slee-service_1_0.dtd">
<service-xml>
    <service>
        <description>Call Controller Service</description>
        <service-name>CallControllerService</service-name>
        <service-vendor>org.mobicents</service-vendor>
        <service-version>0.1</service-version>
        <root-sbb>
            <description>This SBB is going to control the CallBlocking,
                Forwarding and Voicemail service</description>
            <sbb-name>CallControllerSbb</sbb-name>
            <sbb-vendor>org.mobicents</sbb-vendor>
            <sbb-version>0.1</sbb-version>
        </root-sbb>
        <default-priority>0</default-priority>
    </service>
</service-xml>
