<?xml version="1.0" encoding="ISO-8859-1"?>

<!DOCTYPE service-xml PUBLIC "-//Sun Microsystems, Inc.//DTD JAIN SLEE Service 1.0//EN" "slee-service_1_0.dtd">

<service-xml>
    <service>
        <service-name>CMPTest</service-name>
   	<service-vendor>na</service-vendor>
        <service-version>1.0</service-version>
        <root-sbb>
            <sbb-name>CMPTestRootSbb</sbb-name>
       	    <sbb-vendor>na</sbb-vendor>
            <sbb-version>1.0</sbb-version>
        </root-sbb>
        <default-priority>0</default-priority>
    </service>
</service-xml>

