<?xml version="1.0" encoding="ISO-8859-1"?>

<!DOCTYPE service-xml PUBLIC "-//Sun Microsystems, Inc.//DTD JAIN SLEE Service 1.0//EN" "slee-service_1_0.dtd">

<service-xml>
    <service>
        <service-name>DialogTerminated_C3TestService</service-name>
   	<service-vendor>mobicents</service-vendor>
        <service-version>0.1</service-version>
        <root-sbb>
            <sbb-name>DialogTerminated_C3TestSbb</sbb-name>
       	    <sbb-vendor>mobicents</sbb-vendor>
            <sbb-version>0.1</sbb-version>
        </root-sbb>
        <default-priority>0</default-priority>
    </service>
</service-xml>

